{
  "$schema": "https://json-schema.org/draft/2020-12/schema",
  "$id": "https://cannonballgtm.com/contracts/mwr_output.schema.json",
  "title": "MWR Output Artifact",
  "description": "The complete, structured output of the Messages Worth Receiving (MWR) gate. MWR consumes one FHC output artifact and returns, per in-scope segment, a binary verdict: can a PVP-grade message be built from this segmentation work, yes or no. 'yes' carries an exemplar message as evidence; 'no' carries a named gap. Governed by MWR_CONSTITUTION.md v1.5.",
  "type": "object",
  "required": ["mwr_version", "source_artifact", "scope_used", "segment_verdicts"],
  "additionalProperties": false,
  "properties": {
    "mwr_version": {
      "type": "string",
      "description": "Version of the MWR constitution this run was graded against. Example: 1.5",
      "examples": ["1.5"]
    },
    "source_artifact": {
      "type": "object",
      "description": "Identifying metadata copied from the consumed FHC artifact, so a verdict is traceable to the exact input it judged.",
      "required": ["source_agent", "schema_version"],
      "additionalProperties": false,
      "properties": {
        "source_agent": { "type": "string", "description": "FHC artifact's source_agent. Example: FHC v0.5 Beta" },
        "schema_version": { "type": "string", "description": "FHC artifact's schema_version." },
        "generated_at": { "type": "string", "description": "FHC artifact's generated_at, if present." },
        "company": { "type": "string", "description": "brand_profile.company of the consumed artifact." }
      }
    },
    "scope_used": {
      "type": "string",
      "enum": ["Gold", "Silver", "Bronze"],
      "description": "Which tier the gate ran over. Gold by default; Silver or Bronze only under explicit override, and override replaces Gold scope, it does not add to it (constitution Section 3)."
    },
    "override": {
      "type": "boolean",
      "description": "True when the user overrode the default Gold scope. When true, every entry in segment_verdicts that carries an exemplar must carry override_warning.",
      "default": false
    },
    "run_decline": {
      "type": "object",
      "description": "Present for a run-level outcome that produces no per-segment verdicts. Per constitution Section 6 there are two such kinds. kind='brand_gap': brand_profile.value_prop or differentiator is empty, so every segment fails Standard 2 identically and the gate returns ONE decline instead of N identical per-segment 'no's (a real 'no'). kind='empty_scope': the requested tier carries no segments, so there is nothing to gate (a null result, not a quality judgment). When run_decline is present, segment_verdicts is empty.",
      "required": ["kind", "reason", "input_that_would_close_it"],
      "additionalProperties": false,
      "properties": {
        "kind": {
          "type": "string",
          "enum": ["brand_gap", "empty_scope"],
          "description": "brand_gap = a shared brand-profile field is empty (requires missing_fields). empty_scope = no segments in the requested tier (requires scoped_tier)."
        },
        "reason": { "type": "string", "description": "Plain statement of the run-level outcome. brand_gap example: brand profile incomplete: value_prop missing, no segment can clear Standard 2 until supplied. empty_scope example: no Gold segment in the artifact, nothing to gate at the default scope." },
        "missing_fields": {
          "type": "array",
          "minItems": 1,
          "items": { "type": "string", "enum": ["value_prop", "differentiator"] },
          "description": "Present only for kind='brand_gap': which MWR-critical brand_profile fields are empty."
        },
        "scoped_tier": {
          "type": "string",
          "enum": ["Gold", "Silver", "Bronze"],
          "description": "Present only for kind='empty_scope': the tier the gate looked in and found empty."
        },
        "input_that_would_close_it": { "type": "string" }
      },
      "allOf": [
        {
          "if": { "properties": { "kind": { "const": "brand_gap" } }, "required": ["kind"] },
          "then": { "required": ["missing_fields"] }
        },
        {
          "if": { "properties": { "kind": { "const": "empty_scope" } }, "required": ["kind"] },
          "then": { "required": ["scoped_tier"] }
        }
      ]
    },
    "segment_verdicts": {
      "type": "array",
      "description": "One verdict per in-scope segment. Empty when run_decline is present.",
      "items": { "$ref": "#/$defs/segment_verdict" }
    }
  },
  "allOf": [
    {
      "description": "Either the run declined at the brand level (run_decline present, no segment verdicts) or it produced per-segment verdicts (no run_decline).",
      "oneOf": [
        {
          "required": ["run_decline"],
          "properties": { "segment_verdicts": { "maxItems": 0 } }
        },
        {
          "not": { "required": ["run_decline"] },
          "properties": { "segment_verdicts": { "minItems": 1 } }
        }
      ]
    }
  ],
  "$defs": {
    "standard_check": {
      "type": "object",
      "description": "The grader's yes/no on a single Gold Standard. No partial credit. Every 'met: true' must cite the basis that earns it; for Standards 3, 6, and 7 the basis must rest on a 'public'-classed source that survives the two mechanical hardening checks. Grading is dependency-ordered (constitution v1.5 Section 7): Standard 4 is graded first, and if it fails, Standards 5, 6, and 7 fail automatically per the keystone rule.",
      "required": ["standard", "name", "met", "basis"],
      "additionalProperties": false,
      "properties": {
        "standard": { "type": "integer", "minimum": 1, "maximum": 7 },
        "name": {
          "type": "string",
          "enum": [
            "Independently useful",
            "Relates to the value prop",
            "Based on public data",
            "Translates to meaningful insight",
            "Goes beyond pain identification",
            "Creates information asymmetry",
            "Concrete and specific"
          ]
        },
        "met": { "type": "boolean" },
        "basis": {
          "type": "string",
          "description": "On 'met: true', the specific fact/field (and its access_class where the standard requires public) that earns the yes. On 'met: false', why it misses."
        },
        "failure_type": {
          "type": "string",
          "enum": ["independent", "keystone_cascade"],
          "description": "Present only on 'met: false'. 'independent' = this standard failed on its own merits. 'keystone_cascade' = Standards 5, 6, or 7 recorded as failed because Standard 4 (the keystone) failed, not judged on their own. Lets the reviewer see whether the downstream standards fell on their own or because the insight did (constitution v1.5)."
        }
      }
    },
    "segment_verdict": {
      "type": "object",
      "required": ["segment_id", "tier", "name", "pvp_achievable"],
      "additionalProperties": false,
      "properties": {
        "segment_id": { "type": "string" },
        "tier": { "type": "string", "enum": ["Gold", "Silver", "Bronze"] },
        "name": { "type": "string" },
        "recommended": { "type": "boolean", "description": "Carried through from the FHC segment, if present." },
        "pvp_achievable": {
          "type": "string",
          "enum": ["yes", "no"],
          "description": "The gate's binary verdict for this segment. 'yes' requires exemplar; 'no' requires gap."
        },
        "revised": {
          "type": "boolean",
          "description": "True only when pvp_achievable is 'yes' AND the message needed the single revision pass to clear (it cleared on the second attempt, not the first). Constitution Section 7.",
          "default": false
        },
        "exemplar": { "$ref": "#/$defs/exemplar" },
        "gap": { "$ref": "#/$defs/gap" },
        "rejected_exemplar": { "$ref": "#/$defs/rejected_exemplar" }
      },
      "allOf": [
        {
          "description": "A 'yes' carries an exemplar, no gap, and no rejected_exemplar.",
          "if": { "properties": { "pvp_achievable": { "const": "yes" } } },
          "then": { "required": ["exemplar"], "not": { "anyOf": [ { "required": ["gap"] }, { "required": ["rejected_exemplar"] } ] } }
        },
        {
          "description": "A 'no' carries a gap and no exemplar. It MAY carry a rejected_exemplar (the graded, rejected message) for a negative/teaching fixture.",
          "if": { "properties": { "pvp_achievable": { "const": "no" } } },
          "then": { "required": ["gap"], "not": { "required": ["exemplar"] } }
        }
      ]
    },
    "exemplar": {
      "type": "object",
      "description": "The cohort-level evidence message proving a PVP is achievable. NOT a deliverable for scaled use. No merge fields, no account personalization, no CTA, no em-dashes, Cannonball voice. Exactly one subject line and one eyebrow line.",
      "required": ["subject_line", "eyebrow_line", "message_body", "facts_used", "seven_standard_check"],
      "additionalProperties": false,
      "properties": {
        "subject_line": { "type": "string", "description": "Exactly one. No em-dashes." },
        "eyebrow_line": { "type": "string", "description": "Exactly one (preview / eyebrow line). No em-dashes." },
        "message_body": { "type": "string", "description": "The one-step message. Ends on the value, carries no CTA, no em-dashes." },
        "facts_used": {
          "type": "array",
          "description": "The specific_fact values the exemplar concretely uses, with the access_class of each cited source. Lets the reviewer confirm Standard 7 type-spanning and that Standards 3/6/7 rest only on public sources.",
          "minItems": 1,
          "items": {
            "type": "object",
            "required": ["value", "fact_type", "source_name", "publisher", "access_class"],
            "additionalProperties": false,
            "properties": {
              "value": { "type": "string" },
              "fact_type": { "type": "string", "enum": ["number", "date", "name", "location", "event", "amount"] },
              "source_name": { "type": "string" },
              "publisher": { "type": "string" },
              "access_class": { "type": "string", "enum": ["public", "vendor_published", "proprietary"] }
            }
          }
        },
        "seven_standard_check": {
          "type": "array",
          "description": "All seven standards, in order, each yes/no with basis. All seven must be met for the parent verdict to be 'yes'.",
          "minItems": 7,
          "maxItems": 7,
          "items": { "$ref": "#/$defs/standard_check" }
        },
        "override_warning": {
          "type": "string",
          "description": "Required when the run was a Silver/Bronze override. The constitution Section 3 trade-off warning, attached per message."
        }
      }
    },
    "gap": {
      "type": "object",
      "description": "The gate's 'no' for a segment. A first-class output of equal standing to an exemplar, not an error. Names which standard(s) cannot be met and what input would close the gap.",
      "required": ["failed_standards", "what_is_missing", "input_that_would_close_it"],
      "additionalProperties": false,
      "properties": {
        "failed_standards": {
          "type": "array",
          "minItems": 1,
          "items": { "type": "integer", "minimum": 1, "maximum": 7 },
          "description": "The Gold Standard numbers this segment cannot clear (after the single revision pass, if one was attempted)."
        },
        "what_is_missing": { "type": "string", "description": "The concrete gap in the artifact. Example: specific_facts carries one dated value and no named entity." },
        "input_that_would_close_it": { "type": "string", "description": "What the user would add to the FHC artifact to flip this to 'yes'. When entailment_decline is true, this states the FHC work order: which public signal, resolved per member (a members[].edp_value or a resolved_conditions signal), would make the flagged buyer-conditional assertable (constitution v1.5 entailment rule, third exit)." },
        "entailment_decline": {
          "type": "boolean",
          "description": "True when this 'no' is an entailment decline: the message required a claim about the buyer that segment membership does not entail and no per-member signal in the artifact resolves, and the buyer-conditional could not be rewritten away. input_that_would_close_it then carries the FHC work order for the missing per-member signal. Constitution v1.5, entailment rule.",
          "default": false
        }
      }
    },
    "rejected_exemplar": {
      "type": "object",
      "description": "OPTIONAL and only on a 'no' verdict. The message that was graded and rejected, preserved with its scorecard so the failure is inspectable. Production 'no' verdicts normally carry only a gap; this field exists so a negative/teaching fixture can keep the rejected message and its keystone-cascade scorecard (the failure_type field lives here, on the standard_check entries). Not a deliverable; a record of a rejection.",
      "required": ["subject_line", "eyebrow_line", "message_body", "seven_standard_check"],
      "additionalProperties": false,
      "properties": {
        "subject_line": { "type": "string" },
        "eyebrow_line": { "type": "string" },
        "message_body": { "type": "string", "description": "The rejected message body, kept verbatim. It is NOT expected to pass the v1.5 format or entailment rules; that is the point of preserving it." },
        "facts_used": {
          "type": "array",
          "items": {
            "type": "object",
            "required": ["value", "fact_type", "source_name", "publisher", "access_class"],
            "additionalProperties": false,
            "properties": {
              "value": { "type": "string" },
              "fact_type": { "type": "string", "enum": ["number", "date", "name", "location", "event", "amount"] },
              "source_name": { "type": "string" },
              "publisher": { "type": "string" },
              "access_class": { "type": "string", "enum": ["public", "vendor_published", "proprietary"] }
            }
          }
        },
        "seven_standard_check": {
          "type": "array",
          "description": "All seven standards, in dependency order, each yes/no with basis and (on a miss) failure_type. Records the keystone cascade that produced the rejection.",
          "minItems": 7,
          "maxItems": 7,
          "items": { "$ref": "#/$defs/standard_check" }
        },
        "format_defects": {
          "type": "array",
          "items": { "type": "string" },
          "description": "Format-level failures recorded separately from the standard scorecard: buyer-conditional, over-length body, over-length subject, em-dash, or a sender credential in the body."
        },
        "provenance": { "type": "string", "description": "How this rejected message came to be (which agent produced it, under which version it was graded, who overturned it), so the fixture teaches." }
      }
    }
  }
}
